,Unnamed: 0,평점,날짜,제목,내용
666,666,5,21.05.15.,헤라 쿠샨 첫 입문했습니다 워낙 유명해서 주문했는데 밀착력이 정말 좋네요 그리고 저는 화장후에 항상 파우더로 마무리 했는데 요 제품은 쿠션만 두드려도 파우더 한 것,헤라 쿠샨 첫 입문했습니다 워낙 유명해서 주문했는데 밀착력이 정말 좋네요 그리고 저는 화장후에 항상 파우더로 마무리 했는데 요 제품은 쿠션만 두드려도 파우더 한 것 같이 뽀송해요 완전 신기함 ㅠㅜ 다크닝이나 지속력은 계속 써봐야 알겠지만 괜찮으면 계속 쓰려구여ㅎㅎ그리고 중동점이 사은품도 좋고 후기도 좋아서 다른 곳 취소하고 여기서 주문했는데 진짜 배송도 넘 빠르고ㅠㅠ 사은품 구성도 너무 좋아요 리필이나 다른 제품들 앞으로 여기서만 구매하려구여 거울 파우치도 넘 감사해요 자주 이용할게요
667,667,5,21.04.19.,매트 쿠션 중엔 최강인듯요 다른 브랜드 매트 쿠션보다 훨씬 묻어남이 없어요 마스크에 거의 안 묻어나요 바르자 마자 촥 밀착됨이 있어서 바르고 손으로 바로 만져도 뽀송해요 매,매트 쿠션 중엔 최강인듯요 다른 브랜드 매트 쿠션보다 훨씬 묻어남이 없어요 마스크에 거의 안 묻어나요 바르자 마자 촥 밀착됨이 있어서 바르고 손으로 바로 만져도 뽀송해요 매트하니 소량 발라서 빠르게 톡톡톡하는게 좋은 것 같아요 커버력 좋고 지속력이 좋네요 마스크 종일 쓰는 요즘 마스크 벗어도 지워짐이 거의 없이 오래 가요
668,668,5,21.04.09.,커버력은 잘 모르겠으나 컬러나 밀착력은 좋은거 같아요 너무 끈적이지도 않아서 데일리로 정말 마음에 드네요 샘플 주신 구성도 썬끄림에 누드틴트라니 센스있으시네요 잘 쓰겠습니다아,커버력은 잘 모르겠으나 컬러나 밀착력은 좋은거 같아요 너무 끈적이지도 않아서 데일리로 정말 마음에 드네요 샘플 주신 구성도 썬끄림에 누드틴트라니 센스있으시네요 잘 쓰겠습니다아 사진에 빠졌는데 메이크업 픽서도 주셨네요 많이 챙겨주셔서 놓쳤네요 
669,669,5,21.05.25.,뷰튜버 아랑님 라이브방송 보고 주문해서 쓰고 있는데 좋아요 호 쓰는 피부톤이라  시켰는데 제 피부톤에 잘 맞고 저한테 잘 맞아서 그런지 다크닝도 안생겨요 바를때 너무,뷰튜버 아랑님 라이브방송 보고 주문해서 쓰고 있는데 좋아요 호 쓰는 피부톤이라  시켰는데 제 피부톤에 잘 맞고 저한테 잘 맞아서 그런지 다크닝도 안생겨요 바를때 너무 매트하지 않고 촉촉한 느낌인데 번들거리지 않고 약간 뽀송한 느낌으로 마무리되는게 신기해요
670,670,5,21.04.24.,커버력은 그대로 더 얇아져서 밀착력이랑 지속력은 말할것도 없고 무엇보다 이 지점에서 시키길 너무 잘했네요 하루늦는다고 전화도 주시고 샘플도 이렇게 한가득ㅠㅠ 원래 리뷰 잘,커버력은 그대로 더 얇아져서 밀착력이랑 지속력은 말할것도 없고 무엇보다 이 지점에서 시키길 너무 잘했네요 하루늦는다고 전화도 주시고 샘플도 이렇게 한가득ㅠㅠ 원래 리뷰 잘 안쓰는데 쓸 수 밖에 없네요 다들 블쿠 여기서 사세오ㅠㅜ 코로나가 좀 잠잠해지면 직접 매장가서 사야겠어요 감사히 잘 쓰겠습니다
671,671,5,21.04.15.,기존 블랙 쿠션보다 훨씬 만족스러워요 앞으로 이 블랙쿠션에 정착할 것 같아요 커버력 밀착력 다 마음에 들었지만 무엇보다 색이 정말 마음에 들었어요 기존 블쿠는 제 피부톤에,기존 블랙 쿠션보다 훨씬 만족스러워요 앞으로 이 블랙쿠션에 정착할 것 같아요 커버력 밀착력 다 마음에 들었지만 무엇보다 색이 정말 마음에 들었어요 기존 블쿠는 제 피부톤에 비해 어두운 감이 있었는데 이번 블쿠는 완전 착붙이더라구요 포슬린 색으로 구매했는데 텁텁하지도 않고 자연스럽게 밝은 색이라 너무 좋았어요 다들 꼭 사보세요
672,672,5,21.05.16.,색상 고민 엄청하다가 취소하고 다시 주문할까 했는데이미 배송해주셔서 일단 받아봤는데 다행히도 잘맞게 골랐어요 ㅜ이번 쿠션 전작보다 훨씬 밀착력이 좋은거같아요피부표현 뽀얗고 깔끔하,색상 고민 엄청하다가 취소하고 다시 주문할까 했는데이미 배송해주셔서 일단 받아봤는데 다행히도 잘맞게 골랐어요 ㅜ이번 쿠션 전작보다 훨씬 밀착력이 좋은거같아요피부표현 뽀얗고 깔끔하게 잘됩니다구형  로제바닐라 썼었는데 이상하게 세수하고 나왔을때보다 톤이 다운되는 느낌이었거든요랑 이랑 엄청 고민했는데 으로 하길 잘한거같아요로제보단 뉴트럴톤이 훨씬 화사하고 톤이 맞는거같네요호보다 밝거나 코주변이나 뺨에 약간이라도 붉은기가 있는 분들은 보단 이 잘 맞을거같아요배송도 빨리 해주시고 사은품도 많이 챙겨주셔서 좋았어요블랙 매쉬파우치도 맘에들어요
673,673,3,21.04.27.,제품은 좋으나 포장은 꼼꼼히 하지 않으셨나봐요뜯으니 스킨 샘플 하나가 다 쏟아져있어서 종이는 젖어있고  같이 온 다른 스킨 로션 샘플들도 보니 뚜껑이 다 닫히지 않아서 뚜껑이,제품은 좋으나 포장은 꼼꼼히 하지 않으셨나봐요뜯으니 스킨 샘플 하나가 다 쏟아져있어서 종이는 젖어있고  같이 온 다른 스킨 로션 샘플들도 보니 뚜껑이 다 닫히지 않아서 뚜껑이 열리기 일보직전인 상태로 왔어요쿠션은 제가 건성인데 기초 잘하고 얇게 바르니 착 붙어서 괜찮은 것 같아요 여름에 잘쓸것같아요
674,674,5,21.03.31.,아직 써보진 않았고 손등에 테스트민 해봤는데 소량으로도 엄청 잘 발리더라고요 마무리감도 좋은거 같아요 색은 얼굴에 올려봐야 알겠지만 호인데도 좀 밝은감이 있어 아쉽긴 합니다,아직 써보진 않았고 손등에 테스트민 해봤는데 소량으로도 엄청 잘 발리더라고요 마무리감도 좋은거 같아요 색은 얼굴에 올려봐야 알겠지만 호인데도 좀 밝은감이 있어 아쉽긴 합니다 패키지는 예쁘고 좋습니다 다른 구성품들도 잘 왔어요
675,675,5,21.03.27.,와 미쳤어요 진짜 배송 하루만에 온 것도 놀라운데 같이 껴준 샘플이 샘플 같지 않게 너무 고퀄리티라 더 감격스러워요수도권 사는 거 아니라서 배송 다음주 쯤 오겠지 했는데,와 미쳤어요 진짜 배송 하루만에 온 것도 놀라운데 같이 껴준 샘플이 샘플 같지 않게 너무 고퀄리티라 더 감격스러워요수도권 사는 거 아니라서 배송 다음주 쯤 오겠지 했는데 무슨 구매 하자마자 바로 배송 시작 알람 뜨더라구요 평소에 호 써서 이번에도 호 구매 했는데 살짝 밝긴 해도 괜찮아요 그리고 지성 피부들에게 진짜 추천이에요 바르면서 파우더리 해져서 마스크에도 안 묻어나오고 왜 다들 헤라 블랙쿠션 외치는 지 알겠더라구요 다 쓰면 다음에도 또 여기서 사야겠어요
676,676,5,21.05.18.,화장한 지 정말 오랜만에 다시 화장을 하려고 헤라쿠션을 구매했습니다 예전에 써보고 제일 만족했던 화장품이라 헤라로 돌아온건데 만족해요 리필 하나 샀는데 증정품이 알차게 와서 너,화장한 지 정말 오랜만에 다시 화장을 하려고 헤라쿠션을 구매했습니다 예전에 써보고 제일 만족했던 화장품이라 헤라로 돌아온건데 만족해요 리필 하나 샀는데 증정품이 알차게 와서 너무 좋았어요 쿠션이랑 잘 맞는다는 블랙파데도 픽서도 마음에 들어요
677,677,4,21.04.01.,블랙쿠션은 처음인데 작년 여름에 마스크 쓰고 화장이 무너지는게 너무 불편해서 구매해봤습니다 곧 여름이니까요 ㅠ ㅠ 오자마자 사용 해 봤는데 밀착력이 매우 좋은편이구요지속력,블랙쿠션은 처음인데 작년 여름에 마스크 쓰고 화장이 무너지는게 너무 불편해서 구매해봤습니다 곧 여름이니까요 ㅠ ㅠ 오자마자 사용 해 봤는데 밀착력이 매우 좋은편이구요지속력도 아직까지는 괜찮네요 저는 건성이라 여름에 쓰려고 미리 구입했어요 색상은 한 호 사이가 맞는것 같은데 그냥  샀네요 너무 밝은건 싫고 그냥 을 쓰면 안색이 급격히 안좋아져서색상을 잘 고르는게 관건인듯요 왜 요제품이 롱런하는지 알겠더라구요ㅎ
678,678,5,21.05.11.,유튜브에서도 그렇고 하도 헤라블랙쿠션이 좋다고 해서 개월 고민하다가 구매했어요 건성이라걱정했는데생각보다건조하지않고 밀착도 잘되고 모공끼임도 많지 않아서 정말 만족해요,유튜브에서도 그렇고 하도 헤라블랙쿠션이 좋다고 해서 개월 고민하다가 구매했어요 건성이라걱정했는데생각보다건조하지않고 밀착도 잘되고 모공끼임도 많지 않아서 정말 만족해요 색상고민도 있었는데 화사하고싶어서 얼굴이 누런편인데 로 갔는데 색상도 좋네요 다만 미니 쿠션 사은품으로 주시는줄 알고 여기서 구매했는데 없어서 엄청 아쉬웠어요ㅜㅜ
679,679,4,21.04.29.,라이브로구매했어요 계속 끈겨서 제대로 설명은 듣지못했지만 구매한것에 만족옛부터 헤라블랙쿠션 유명하다는 얘길들어도 써보지않았지만 이번엔다르다는 사실색상도다양하고 더촉촉하면서 물광효과,라이브로구매했어요 계속 끈겨서 제대로 설명은 듣지못했지만 구매한것에 만족옛부터 헤라블랙쿠션 유명하다는 얘길들어도 써보지않았지만 이번엔다르다는 사실색상도다양하고 더촉촉하면서 물광효과좋아요ㅎ애용하고있어요블랙이라깔끔하니 이뻐 
680,680,5,21.04.28.,헤라 블랙 쿠션 다들 좋은지 아시겠죠 저는 완전 지성 피부인데 블쿠 만난 이후로 문제 없이 지내고 있어요 리뉴얼 됐다고 해서 새로 사봤는데 너무 두껍게 바르지만 않으면 픽싱도,헤라 블랙 쿠션 다들 좋은지 아시겠죠 저는 완전 지성 피부인데 블쿠 만난 이후로 문제 없이 지내고 있어요 리뉴얼 됐다고 해서 새로 사봤는데 너무 두껍게 바르지만 않으면 픽싱도 잘돼고 매우 좋습니당  중간에 배송 문제가 있었는데 최대한 빠르게 처리해주셨습니다 이쁘게 잘 쓰겠습니다 
681,681,5,21.04.02.,헤라 블랙쿠션 호 글로우 래스팅 쿠션 호  미스트 쿠션 인가 호였구 전부 핑크베이스인걸로 샀었어요 헤라 쿠션만 항상 써왔는데 이번에 블랙쿠션 리뉴얼 되었,헤라 블랙쿠션 호 글로우 래스팅 쿠션 호  미스트 쿠션 인가 호였구 전부 핑크베이스인걸로 샀었어요헤라 쿠션만 항상 써왔는데 이번에 블랙쿠션 리뉴얼 되었다해서 바로 구매했습니다 개중에서는 블랙쿠션이 제일 핑크빛 돌았어요이전 블랙쿠션보다 훨씬 밀착력도 좋고 오래 오지됩니다
682,682,5,21.04.28.,원래 리뷰를 잘 쓰지 않는 소비자이건만 이번에 리뷰를 안 쓸 수가 없네요 꼼꼼한 제품포장에 신경써서 챙겨주시는 풍부한 샘플까지 모두 감탄했습니다 블랙쿠션에 정착한지 오래라,원래 리뷰를 잘 쓰지 않는 소비자이건만 이번에 리뷰를 안 쓸 수가 없네요 꼼꼼한 제품포장에 신경써서 챙겨주시는 풍부한 샘플까지 모두 감탄했습니다 블랙쿠션에 정착한지 오래라 여기저기 주문해봤지만 이렇게 세심하게 일하시는 판매자는 첨이네요 스토어찜하고 재구매 각입니다 판매자님 화이팅
683,683,5,21.05.31.,저렴하게 할인된 가격에 구성품들까지 완벽한거 같아요기존 헤라쿠션만 써왔는데 리뉴얼 됐다고 해서 구입했습니다 마스크에 아예 안묻어 나오는건 아니지만 그래도 커버력과 무너짐도 예,저렴하게 할인된 가격에 구성품들까지 완벽한거 같아요기존 헤라쿠션만 써왔는데 리뉴얼 됐다고 해서 구입했습니다 마스크에 아예 안묻어 나오는건 아니지만 그래도 커버력과 무너짐도 예쁘게 무너져서 좋아요 애용할게요
684,684,4,21.05.13.,마스크에 아예 안 묻어나는 건 아니지만 다른 제품에 비해서는 덜 하긴해요 대신 무너짐이 예쁘고 지속력도 긴 것 같아서 만족하면서 쓰고 있어요 평소 호 제품 사용하는데 은,마스크에 아예 안 묻어나는 건 아니지만 다른 제품에 비해서는 덜 하긴해요 대신 무너짐이 예쁘고 지속력도 긴 것 같아서 만족하면서 쓰고 있어요 평소 호 제품 사용하는데 은 차분하게 어울려서 화사한 컬러 원하시면 로 가는게 좋을 것 같아요
685,685,5,21.05.24.,디자인 바뀌고 처음 써보는데 더 좋아진거 같아요내용물 넓이가 넓어져서 쿠션으로 톡톡 누를때 가장자리 안묻고 넘 좋아요 처음 커버 열때 어떻게 여는지 몰라서 당황했는데 자석이라서,디자인 바뀌고 처음 써보는데 더 좋아진거 같아요내용물 넓이가 넓어져서 쿠션으로 톡톡 누를때 가장자리 안묻고 넘 좋아요 처음 커버 열때 어떻게 여는지 몰라서 당황했는데 자석이라서 그런지 조금 힘주고 열면 되더라구요넘 만족해요
686,686,4,21.04.28.,라방보다 마스크에 묻어나지 않는다는 설명한마디에 다른거 듣지두 않구 구매했어요 요즘 마스크 없인 외출도 못하잖아요 설명만큼 아예안묻어나는건 아니라서 별하나는 뺏지만 그래두 다른,라방보다 마스크에 묻어나지 않는다는 설명한마디에 다른거 듣지두 않구 구매했어요 요즘 마스크 없인 외출도 못하잖아요 설명만큼 아예안묻어나는건 아니라서 별하나는 뺏지만 그래두 다른제품들에비하면 확실히 안묻긴하더라구요 밀착력두 나쁘지않구 커버력이 아주 좋진않지만 두껍지않게 발려서 전좋아요
687,687,5,21.04.14.,헤라 현백 무역점 네이버 스토어에서 저렴하게 잘 구입했습니다 포장도 너무 예쁘게 해주시고 제가 써보고 싶었던 블랙파데랑 립 제품들까지 같이 보내주셔서 넘 좋아요 쿠션이랑 호,헤라 현백 무역점 네이버 스토어에서 저렴하게 잘 구입했습니다포장도 너무 예쁘게 해주시고 제가 써보고 싶었던 블랙파데랑 립 제품들까지 같이 보내주셔서 넘 좋아요 쿠션이랑 호수 맞춰서 보내주시는 센스까지 감사합니다 블쿠 유명한 건 말해뭐해 
688,688,5,21.03.31.,리뉴얼 된 제품이 더 밀착력이 우수합니다조금 더 묽은 제형으로 피부에 잘 달라붙고스펀지 망 부분이 이전에는 고정이 잘 되지않고이리저리 움직였다면 이번에 새로나온 쿠션은스펀지를,리뉴얼 된 제품이 더 밀착력이 우수합니다조금 더 묽은 제형으로 피부에 잘 달라붙고스펀지 망 부분이 이전에는 고정이 잘 되지않고이리저리 움직였다면 이번에 새로나온 쿠션은스펀지를 케이스가 고정시켜줘서 움직이지 않고제품력은 말할 것도 없구요역시 믿고 사용하는 헤라입니다 
689,689,5,21.04.13.,배송 정말 칼 배송이네요 엄청 빨리 도착했어용헤라쿠션 워낙 유명해서 한번 써보고 싶었는데저렴한 가격에 잘 산것 같아요과거에 입생쿠션 호수 잘못 선택해서 망한적 있어서백화점에서 테,배송 정말 칼 배송이네요 엄청 빨리 도착했어용헤라쿠션 워낙 유명해서 한번 써보고 싶었는데저렴한 가격에 잘 산것 같아요과거에 입생쿠션 호수 잘못 선택해서 망한적 있어서백화점에서 테스트해보고 인터넷이 더 저렴해서여기서 구매했습니다 넘 감사해요조그마한 립틴트는 넘 귀여워요 ㅎㅎ
690,690,5,21.05.28.,트러블 자국이 좀 있는 편인데 소량으로도 커버가 잘되는 편입니다 오늘 처음 사용해봐서 지속력쪽은 지켜봐야겠지만 마스크 때문에 지속력 측면에서는 객관적인 평가가 좀 어려울 것,트러블 자국이 좀 있는 편인데 소량으로도 커버가 잘되는 편입니다 오늘 처음 사용해봐서 지속력쪽은 지켜봐야겠지만 마스크 때문에 지속력 측면에서는 객관적인 평가가 좀 어려울 것 같구요ㅠㅠ커버력 밀착력은 모두 만족합니다
691,691,5,21.05.15.,지성인데 처음에 바를때는 좀 뜬다 그런 느낌이 있어서 지성이어도 쿠션 바르기 전에 과하다 싶을 정도로 수분크림 바르고 쿠션 올리면 좋아용 시간 지났을 때 기름 올라오면 오히려 피,지성인데 처음에 바를때는 좀 뜬다 그런 느낌이 있어서 지성이어도 쿠션 바르기 전에 과하다 싶을 정도로 수분크림 바르고 쿠션 올리면 좋아용 시간 지났을 때 기름 올라오면 오히려 피부에 쿠션이 흡수되는 느낌 처음 발랐을 때 보다 더 이쁜거 같더라구요 ㅎㅎ 좋아요
692,692,1,21.04.04.,기존 블랙쿠션만 써오다가 리뉴얼 됐다길래 사봤는데 개인적으로 불호네요 기대를 많이해서 그런건지 모르겠지만 지속력이며 무너질 때며 예전 버전이 훨씬 나은 것 같아요 너무 더럽게,기존 블랙쿠션만 써오다가 리뉴얼 됐다길래 사봤는데 개인적으로 불호네요 기대를 많이해서 그런건지 모르겠지만 지속력이며 무너질 때며 예전 버전이 훨씬 나은 것 같아요 너무 더럽게 무너져요 향도 독한 느낌이에요 바를 때 바로 뽀송한 느낌이 드는 건 좋은데 덧바르기 시작하면 오히려 얼굴에 있던 수분까지 싹 다 뺏겨서 나중엔 유분이 더 넘치게 되는 것 같았어요 재구매 의사 없음
693,693,4,21.04.01.,코로나 때문에 거즘 년동안 화장을 잘안해서 화장품을 다 버렸어요 그러다가 봄도오고 팩트는 하나 있어야지 하고 구매했는데 건성피부지만 욕심이 나더라구요 케이스도 너무 예쁘고 ㅎㅎ,코로나 때문에 거즘 년동안 화장을 잘안해서 화장품을 다 버렸어요 그러다가 봄도오고 팩트는 하나 있어야지 하고 구매했는데 건성피부지만 욕심이 나더라구요 케이스도 너무 예쁘고 ㅎㅎ 첨에 바르고 많이 뜬다 라는 느낌은 있었는데 몇번 두드려주니 밀착이 되더라구요 생각보다 덜뜨기는 했는데 시간이 지나면 피부 당김이 있어요 몇번더 써봐야겠지만 저는 나름 만족 합니다 사은품도 많이 주셔서 좋구요
694,694,4,21.04.13.,얇게 터치해서 피부에 올리니 가볍게 밀착되네요ㅎㅎ 지속력은 꽤나 괜찮을 것 같아요 다만 수정화장시에 살짝 뭉침이 있을 것만 같은 파우더리한 마무리라서 수정화장에 조금 신경써,얇게 터치해서 피부에 올리니 가볍게 밀착되네요ㅎㅎ 지속력은 꽤나 괜찮을 것 같아요 다만 수정화장시에 살짝 뭉침이 있을 것만 같은 파우더리한 마무리라서 수정화장에 조금 신경써야 될 거 같아요 마스크 쓰고도 괜찮을 것 같아요
695,695,4,21.05.20.,가장 대중적인 컬러라 그런지 오래 기다려서 받을 수 있었던 것 같아요코로나로 마스크 쓰고 파데 쿠션 거의 안 쓰다보니 기존에 가지고 있던 것들이 다 오래돼서 새로 구입해보았습니다,가장 대중적인 컬러라 그런지 오래 기다려서 받을 수 있었던 것 같아요코로나로 마스크 쓰고 파데 쿠션 거의 안 쓰다보니 기존에 가지고 있던 것들이 다 오래돼서 새로 구입해보았습니다유투브에서 헤라쿠션 마스크에 안 묻어나게 바르기 영상이 이 제품을 사는데 큰 영향을 준 것 같아요묻어나기는 다 묻어나는 것 같습니다만 그래도 좀 덜한 것 같아요
696,696,5,21.04.20.,블랙쿠션 궁금하기도하고 라이브때 할인에 구매해보았습니다 이틀 사용해보았는데 일단 퍼프에 남는 흡수되는 양이 적은거같아서 이점이 마음에 들었어요 색상도 괜찮구요아 그리고 자석,블랙쿠션 궁금하기도하고 라이브때 할인에 구매해보았습니다 이틀 사용해보았는데 일단 퍼프에 남는 흡수되는 양이 적은거같아서 이점이 마음에 들었어요 색상도 괜찮구요아 그리고 자석으로 열고 닫는 느낌도 좋고 추가 구성품 구성도 좋아요
697,697,5,21.04.19.,워낙 유명해서 궁금했는데 잡티도 너무 많고 잘 뜨는 피부라 쉽게 바꾸질 못하겠더라고요마침 다른제품을 다 써서 고민하다 바꿔봤는데 밀착감이 정말 좋네요커버력은 뛰어나게 좋진않지만,워낙 유명해서 궁금했는데 잡티도 너무 많고 잘 뜨는 피부라 쉽게 바꾸질 못하겠더라고요마침 다른제품을 다 써서 고민하다 바꿔봤는데 밀착감이 정말 좋네요커버력은 뛰어나게 좋진않지만 희안하게 정돈된 느낌이 들어요케이스도 깔끔하고 여닫는것도 고급져요다만 광택이 적은듯해서 피부가 매트해보이네요색상은
698,698,5,21.05.28.,블랙파데 사용하는 사람이고 수정용으로 쿠션 샀어요 근데 늦잠자거나 귀찮을때 쿠션만 사용해줘도 피부표현 미쳐요 커버는 파데만 못하지만 어느정도 옅은 점들은 흐릿하게 가려집니당 리,블랙파데 사용하는 사람이고 수정용으로 쿠션 샀어요 근데 늦잠자거나 귀찮을때 쿠션만 사용해줘도 피부표현 미쳐요 커버는 파데만 못하지만 어느정도 옅은 점들은 흐릿하게 가려집니당 리뉴얼 오지게 한거 티나요 진짜 블렉라인 절대 영원해
699,699,5,21.03.31.,오늘 처음 사용해서 자세히 모르겠어요몇번 더 사용해야 알것 같구요 마스크 묻어남은 살짝 있어요다른 쿠션에 비해 적게 묻어납니다 기존에도 블랙쿠션을 사용했는데 디자인도 이쁘고,오늘 처음 사용해서 자세히 모르겠어요몇번 더 사용해야 알것 같구요 마스크 묻어남은 살짝 있어요다른 쿠션에 비해 적게 묻어납니다 기존에도 블랙쿠션을 사용했는데디자인도 이쁘고 리필과 퍼프를 더 많이 받아 좋습니다
700,700,5,21.04.17.,하루종일 마스크 쓰고 있는 상태에서 어떤 제품을 사용하던 너무 뜨고 묻어남이 심해서 파데프리로 지내고 있었는데 이 제품은 정말 좋아요ㅠ 피부가 수부지라 약간 건조함이 느껴지지만,하루종일 마스크 쓰고 있는 상태에서 어떤 제품을 사용하던 너무 뜨고 묻어남이 심해서 파데프리로 지내고 있었는데 이 제품은 정말 좋아요ㅠ 피부가 수부지라 약간 건조함이 느껴지지만 기초를 잘하고 바르면 문제 없을정도입니다
701,701,5,21.05.13.,잘 쓰고 있어요 커버 잘되고 피부톤도 부드럽게 표현되요 유지도 꽤 잘되는 것 같고 마스크에 묻어나는건 이 정도 커버력이면 안묻는게 이상한 것 같아요ㅎㅎ 잘 쓰고 있습니다,잘 쓰고 있어요 커버 잘되고 피부톤도 부드럽게 표현되요 유지도 꽤 잘되는 것 같고 마스크에 묻어나는건 이 정도 커버력이면 안묻는게 이상한 것 같아요ㅎㅎ 잘 쓰고 있습니다 잠시 헤라를 떠나있다가 돌고 돌아 다시 돌아왔어요 자석처럼 여닫히고 더 편해진듯
702,702,5,21.04.20.,참고로 피부 밝은편아닌데 가 딱 맞았구요 비교하기 그렇지만 킬커버 쓰다 이거 쓰니 더 커버력 좋고 밀착력 좋은데요 수부지라서 티존 빼곤 건조한편인데도 들뜸 없고 시간 지나,참고로 피부 밝은편아닌데 가 딱 맞았구요 비교하기 그렇지만 킬커버 쓰다 이거 쓰니 더 커버력 좋고 밀착력 좋은데요 수부지라서 티존 빼곤 건조한편인데도 들뜸 없고 시간 지나고 무너질때도 예쁘게 무너져요 헤라 처음인데 비싼값하네요
703,703,4,21.04.01.,일단 구성이 너무 좋았고 제품력도 좋았으나 점 준 이유는 내 피부 타입에 적절하진 않았기 때문이다 얼굴에 붉은기가 많아도 피부결 자체는 고운 편인 사람이 바르면 밀착력도 상당히,일단 구성이 너무 좋았고 제품력도 좋았으나 점 준 이유는 내 피부 타입에 적절하진 않았기 때문이다 얼굴에 붉은기가 많아도 피부결 자체는 고운 편인 사람이 바르면 밀착력도 상당히 우수하고 얇게 올라가서 만족할텐데 모공이 크거나 패인 흉터가 있는 사람은 클 신상 쿠션 대비 만족도가 많이 높진 않을 것 같다내 피부엔 클 것이 더 좋았음 그건 퍼프의 문제인 탓도 있다 싶긴 한데 피부결이 괜찮고 홍조 정도가 문제인 사람은 마스크에도 덜 묻는 편이기에 만족할만하다
