,Unnamed: 0,평점,날짜,제목,내용
264,264,5,21.03.30.,건성이라 촉촉한 쿠션을 선호했는데 지속력이나 밀착력부분으로 마스크를 쓰는 요즘 너무 화장이 잘날아가 전부터 궁금했던 헤라쿠션을 구매하게되었는데 얇게 발리고 밀착력과 커버력 완전 만,건성이라 촉촉한 쿠션을 선호했는데 지속력이나 밀착력부분으로 마스크를 쓰는 요즘 너무 화장이 잘날아가 전부터 궁금했던 헤라쿠션을 구매하게되었는데 얇게 발리고 밀착력과 커버력 완전 만족이예요 존 건성이라 보습을 두겹정도 볼에 해주고 바르니 눈밑당김 이라던지 건조해서 뜨는부분도 없었어요여름내내 진짜 잘쓸것같고 쿨톤이지만 볼홍조와 혈관비침이있어서  으로 하니까 너무 밝지도않고 붉은기 커버도 잘되서 피부표현이 더 깔끔한것같아요 여름철 홍조 걱정되면 내추럴컬러로 한톤밝은거 쓰셔도될듯
265,265,4,21.05.16.,웜톤피부 매장에서 맞는 색상 팔뚝해본 거는 가 화사한 느낌하지만 차분하고 깨끗해보이기위해 을 선택했어요 이거 주문 당시 모든몰에서 호색상품절이더라구요 파우치,웜톤피부 매장에서 맞는 색상 팔뚝해본 거는 가 화사한 느낌하지만 차분하고 깨끗해보이기위해 을 선택했어요 이거 주문 당시 모든몰에서 호색상품절이더라구요 파우치보다는 쿠션퍼프가 더 필요한데 파우치는 실망  줄을 떼버리고 미니가방에 쿠션과 동봉된 립틴트넣기엔 적당할듯요립틴트는 톡 찍고 스머징하면 괜찮더라구요 오렌지 느낌이 있어요쿠션자체는 커버력도 있는 편이라 만족스럽습니다평소 호보다 밝은 피부 화사함보단 깨끗하게 보이는데에 만족리필구입땐  해봐얄듯요참 빨리 건조해져요 
266,266,4,21.05.09.,후기가 엄청 좋아서 샀는데 번 써본 결과로는 우선 매트해서 마스크에 잘안묻어나긴하는데 건조해서 나중에 얼굴이 간지러워요 기초를 잘 해야될 것 같아요 마스크를 장시간끼고있으면,후기가 엄청 좋아서 샀는데 번 써본 결과로는 우선 매트해서 마스크에 잘안묻어나긴하는데 건조해서 나중에 얼굴이 간지러워요 기초를 잘 해야될 것 같아요 마스크를 장시간끼고있으면 묻어남이 있는건 어쩔 수 없네요 제가 기초를 잘해서 다시 잘 써봐야겠어요밀착력은 좋고 얇게 발라서 그런가 커버력은 잘 모르겠어요 여러번도 발라보고 나중에 한달후기 쓰러올게요 사은품도 많이 주시고 쿠션케이스도 이쁘고 다 만족합니다 제 스킬이 부족한거겠죠 ㅠㅠ
267,267,5,21.03.27.,헤라 블랙쿠션 년 넘게 사용 하던 중이였어요기존 제품을 다 써서 구매 하려고 알아보던중 새로운 상품이 나왔다고 하여 구매 해보았어요기존 제품에 비해 금액이 높아졌고 케이스도,헤라 블랙쿠션 년 넘게 사용 하던 중이였어요기존 제품을 다 써서 구매 하려고 알아보던중새로운 상품이 나왔다고 하여 구매 해보았어요기존 제품에 비해 금액이 높아졌고케이스도 좀 커졌네요워낙 헤라 블랙쿠션이 타 상품들에 비해서발림성과 피부에밀착되는 색상이 자연스러워 좋다고생각 했었어요마스크에 묻어남이 확실히 덜 하네요같이주신 틴트와 클렌징폼도 잘 사용 해보겠습니다
268,268,5,21.04.08.,엄마가 항상 사용하시는 제품이라 리필만 구매하려다가 새로운 패키징으로 출시되었길래 구매했어요 커버력도 좋고 밀착력도 좋고 유지력도 적당하고 들뜨지않으면서도 세미매트하게 피부표현,엄마가 항상 사용하시는 제품이라 리필만 구매하려다가 새로운 패키징으로 출시되었길래 구매했어요 커버력도 좋고 밀착력도 좋고 유지력도 적당하고 들뜨지않으면서도 세미매트하게 피부표현이 예쁘다고 들어서 저도 다른 호수로 사용해보려고해요 본품을 주문했는데 용량의 메이크업 픽서와 퍼프가 같이 와서 정말 좋아요 쿠션파운데이션은 매일 사용하다보면특히 여름 퍼프가 축축해지고 먼지도 붙고 냄새가 나서 비위생적으로 느껴지는데 헤라 블랙쿠션 퍼프로 입을 증정받아서 잘 쓸것같아요
269,269,5,21.04.07.,원래는 호를 사용했었는데요  이번에 리뉴얼 되면서 기존에 호가 리뉴얼된 발랙쿠션 호라고 하여  구매했습니다  색상은 좀 더 밝아진듯 하고 커버력은 여전히 오래,원래는 호를 사용했었는데요 이번에 리뉴얼 되면서 기존에 호가 리뉴얼된 발랙쿠션 호라고 하여  구매했습니다 색상은 좀 더 밝아진듯 하고커버력은 여전히 오래 유지되서 좋구요마스크에 묻어나지 않는것이 가장 신기방기해요 타 제품들중 대부분은 브랜드만 믿고 사는 경우가 많은데 가격적인 부분에서도 괜찮다고 생각합니다  더 비싼 브랜드들 제품도 이정도로 오래 유지되거나 마스크에 안묻는 제품 없거든요 ㅋ 대 초반부터 사용하던 헤라인데대가 되어서도 함께하네요 ㅋ영원했으면 좋겠습니다  헤라 포에버
270,270,5,21.04.09.,사은품도 좋고 좋지만 없어도 될 립 제품인 거 같아요 초밀착에 있는 립 제품은 향을 얼마나 넣었나 입술에 닿고 바르는 순간 입안에서 그 향이 맴돌아서 울렁울렁합니다 색깔은 참 이쁜,사은품도 좋고 좋지만 없어도 될 립 제품인 거 같아요 초밀착에 있는 립 제품은 향을 얼마나 넣었나 입술에 닿고 바르는 순간 입안에서 그 향이 맴돌아서 울렁울렁합니다 색깔은 참 이쁜데사은품으로 받은 클렌징 폼은 크리미하니 좋지만 냄새가 역해요 향기 추가할 때 서로 안 맞는 걸 넣어서 나는 역한 냄새에요전 버전 헤라를 결제했으나 품절이 되면서 뭘 사야 할지 고민만 됐었는데 뉴버전이 더 좋게 나와 좋네요행사 겸 잘 산거 같아서 만족합니다엄마가 다른 제품 쿠션을 다 써서 하나 더 삽니다
271,271,5,21.04.04.,런칭 때 좋은 가격으로 잘 구매했어요블랙쿠션 처음 사용해보는데 대만족 사은품들도 모두 잘 사용중이고특히 립은 조만간 구매할 것 같아요 ㅎㅎ같이 받은 동그란 파우치는 라이,런칭 때 좋은 가격으로 잘 구매했어요블랙쿠션 처음 사용해보는데 대만족 사은품들도 모두 잘 사용중이고특히 립은 조만간 구매할 것 같아요 ㅎㅎ같이 받은 동그란 파우치는 라이브때 봤던것보다 저렴해보여서 매고다니지는 못할 것 같아요ㅋㅋ
272,272,5,21.05.20.,생각보다 빨리 도착했어요 로 주문했는데 평소 호 정도 쓰는 쿨톤이쓰기 적합하다고 생각했어요  처음엔 좀 찐득거리나 싶긴 했는데 시간 지나면서 마무리감이 보송하니 좋아집,생각보다 빨리 도착했어요 로 주문했는데 평소 호 정도 쓰는 쿨톤이쓰기 적합하다고 생각했어요  처음엔 좀 찐득거리나 싶긴 했는데 시간 지나면서 마무리감이 보송하니 좋아집니다 만족스러워요같이 보내주신 헤어핀이랑 샘플들도 만족스러워요
273,273,5,21.05.21.,날씨가 따뜻해지면서 매트한 쿠션 찾고있었는데헤라 쿠션을 발견약간 지성피부인데 이 쿠션은 시간이 지나도 기름이 안올라오고 너무 좋아요 커버력도 완벽하진 않지만 무난하게 가려집니다,날씨가 따뜻해지면서 매트한 쿠션 찾고있었는데헤라 쿠션을 발견약간 지성피부인데 이 쿠션은 시간이 지나도 기름이 안올라오고 너무 좋아요 커버력도 완벽하진 않지만 무난하게 가려집니다하얀 피부인데 호도 그렇게 밝게 느껴지진 않아서 더 좋은 것 같아요 피부색과 잘 어우러지는무튼 짱짱 만족입니다
274,274,4,21.04.19.,트러블 홍조가 심한 피부라 더블웨어밖에 안 쓰다가 이 쿠션 하도 좋다길래 사봤어요 우선 저는 더블웨어 본샌드 색상 섞어 쓰는 호 정도 피부인데 바닐라 색상 조금,트러블 홍조가 심한 피부라 더블웨어밖에 안 쓰다가 이 쿠션 하도 좋다길래 사봤어요우선 저는 더블웨어 본샌드 색상 섞어 쓰는 호 정도 피부인데 바닐라 색상 조금 밝아요 ㅠㅠ그래도 밀착력 좋고 커버력 좋아서 웬만한 홍조는 다 커버되네요다만 더블웨어급 매트함으로 기초는 신경써서 해야돼요사은품도 왕창 받구 좋아용 여기에서 구매하세요들
275,275,5,21.04.13.,블랙 쿠션 유명해서 써보고 싶었는데 이제야 써보네요 전체적으로 밀착력도 좋고 중요하게 생각하는 무너짐도 좋아요 다크닝이 좀 있는 것 같은데 그건 좀 더 사용해봐야 할 것 같,블랙 쿠션 유명해서 써보고 싶었는데 이제야 써보네요전체적으로 밀착력도 좋고중요하게 생각하는 무너짐도 좋아요다크닝이 좀 있는 것 같은데 그건 좀 더 사용해봐야 할 것 같습니다샘플많이 챙겨주셔서 이것저것 써보고 괜찮은거 있으면 주문해보려고요좋은 상품 빠른 배송 감사합니다
276,276,5,21.05.20.,리뉴얼 전 호 쓰다 이번에 으로 구매했는데 확실히 더 밝아요 그리고 들뜨거나 각질부각 하나도 없고 아침 시부터 점심 먹고도 수정화장 안 해도 될 정도로 깨끗하게 오래가,리뉴얼 전 호 쓰다 이번에 으로 구매했는데 확실히 더 밝아요 그리고 들뜨거나 각질부각 하나도 없고 아침 시부터 점심 먹고도 수정화장 안 해도 될 정도로 깨끗하게 오래가요  이전에는 마스크에 묻어남이 심했는데 얜 진짜 하나두 안 묻어요 진짜 너무 좋아서 헤라 파데도 구매하려고요 ㅎㅎ
277,277,4,21.05.17.,일에 구매하고 오늘 받았어요 봄 햇빛에 피부가 많이 타서 가 저한테는 밝네요 피부가 건조한 편이라 보습을 잘하고 하지 않음 조금 건조하게 느껴지는데 여름되면 괜찮을,일에 구매하고 오늘 받았어요 봄 햇빛에 피부가 많이 타서 가 저한테는 밝네요 피부가 건조한 편이라 보습을 잘하고 하지 않음 조금 건조하게 느껴지는데 여름되면 괜찮을거 같아요 샘플로 같이온 미니틴트와 본쿠션은 향이 제 취향은 아니에요 개인적으로 무향이 좋은데 향이 진해서 호불호가 있을거 같아요 좀 더 사용해보고 다시 올릴게요
278,278,4,21.04.16.,어떤 쿠션이 좋을까 고민고민하다 유튜브에서 개의 제품을 협찬없이 내돈내산으로 꼼꼼하게 비교해주는 영상을보고 리뷰어도 그렇고 댓글에서 거의 대부분의 사람들이 헤라 블쿠를 극찬,어떤 쿠션이 좋을까 고민고민하다 유튜브에서 개의 제품을 협찬없이 내돈내산으로 꼼꼼하게 비교해주는 영상을보고 리뷰어도 그렇고 댓글에서 거의 대부분의 사람들이 헤라 블쿠를 극찬 하길래 믿고 으로구매했습니다 받자마자 냅다 얼굴에 발라봤는데 오 아주 자연스러운 피부표현 완전 좋네요 휴지랑 휴대폰으로 테스트해보니 묻어남도 거의없고 굿굿 딱한가지 아쉬운점은 향이 너무 강해요ㅠㅠ 제가 향에 민감하긴한데 처음 써봐서 그런가 암튼 잘 쓰겠습니다
279,279,3,21.04.23.,커버력과 밀착력은 우수합니다만 건조하거나 잔주름 많은 분들은 바르는 스킬이나 순서를 잘 생각하고 정성을 들여야 할 듯 합니다 제 잔주름이 이렇게나 늘었는지 각성하게 해줘서 한편으,커버력과 밀착력은 우수합니다만 건조하거나 잔주름 많은 분들은 바르는 스킬이나 순서를 잘 생각하고 정성을 들여야 할 듯 합니다 제 잔주름이 이렇게나 늘었는지 각성하게 해줘서 한편으론 고맙기도 합니다현재 저의 피부 상태에는 맞지 않지만 커버력이 뛰어나서 주름관리 빡세게 해서 나중에 꼭 다 쓰고 싶어요아 사은품 넉넉히 챙겨주셔서 좋았어요
280,280,5,21.04.02.,믿고쓰는 헤라인데 블랙쿠션도 너무 좋았는데 이번것도 너무 좋아요일단 밀착력 말할것도 없고 케이스부터 이쁘고 색도 이번에 이쁘게 나온것 같아요 맑고 얇은데 커버력이 좋습,믿고쓰는 헤라인데 블랙쿠션도 너무 좋았는데 이번것도 너무 좋아요일단 밀착력 말할것도 없고 케이스부터 이쁘고 색도 이번에 이쁘게 나온것 같아요 맑고 얇은데 커버력이 좋습니다그리고 케이스는 글로우 쿠션때 케이스랑 같은건데 자석으로 되어있어서 너무 편했습니다저는 수부지라서 선크림 촉촉한걸로 바르고 쿠션 올리고 파우더 살짝했는데 딱 괜찮았고 마스크에도 확실히 덜 묻어나옵니다
281,281,5,21.04.19.,평소 호 쓰는데 할까 할까 고민하다가  모두 품절로  구입하게 됐어요호도 충분히 밝고 커버력이 좋은데 정말 뽀송하기까지 해요그치만 마스크에 안묻을 정도,평소 호 쓰는데할까 할까 고민하다가  모두 품절로  구입하게 됐어요호도 충분히 밝고 커버력이 좋은데 정말 뽀송하기까지 해요그치만 마스크에 안묻을 정도로 매트한건 아니에요볼은 건성 이마랑 코는 지성인 복합성 피부인데아무래도 시쯤 화장하고 시쯤 다시 화장해야 해요이건 어쩔 수 없나봐요한달 써보고 또 리뷰 달게요
282,282,4,21.04.03.,처음엔 피부에 착 붙는 느낌이 아니다 싶었는데 며칠 써보니 괜찮은거같아요 쿠션도 쿠션이지만 저는 같이 온 미니미 틴트가 너무 좋더라구요 큰 기대 없이 발라봤는데 제 입술색이랑,처음엔 피부에 착 붙는 느낌이 아니다 싶었는데 며칠 써보니 괜찮은거같아요 쿠션도 쿠션이지만 저는 같이 온 미니미 틴트가 너무 좋더라구요 큰 기대 없이 발라봤는데 제 입술색이랑 넘넘 착붙이에요ㅎㅎ 너무 과한 색은 피하는 편인데 요건 자연스러우면서도 생기를 불어넣어주는것이 데일리로 넘 잘쓰고있습니다 틴트는 본품으로 다시 구매할 생각이에요 
283,283,5,21.04.16.,코로나이후 첨 사본 화장품인데한번에 성공ㅜㅜ 역시 백화점꺼사야는듯ㅋ가지고있는 팩트는 다 버려도되겠어요ㅋ그동안 샀던팩트는 색상이 안맞거나 화장이 뜨거나 밀리는데 이건 착붙느낌매,코로나이후 첨 사본 화장품인데한번에 성공ㅜㅜ 역시 백화점꺼사야는듯ㅋ가지고있는 팩트는 다 버려도되겠어요ㅋ그동안 샀던팩트는 색상이 안맞거나 화장이 뜨거나 밀리는데 이건 착붙느낌매트하대서 걱정했는데 기초바르고하면 뽀송뽀송한 느낌 여름 다가오는데 딱이에용샘플도 향수때매 여기서 구매했는데다른것도 넘 만족스럽게 보내주셔서 감사드려요 늦은시간 문의드려 죄송했는데친절한답변해주셔서 감사했어용
284,284,3,21.05.27.,스킨 케어 방법에 따라 후기가 많이 달라질 것 같아요 저는 평소 방법이 블쿠랑 잘 안맞았는지 손이 잘 안갔어요 아마 쿠션 몇개 가지고 계신데다가 스킨케어 방법하고 안맞으시면 굳,스킨 케어 방법에 따라 후기가 많이 달라질 것 같아요 저는 평소 방법이 블쿠랑 잘 안맞았는지 손이 잘 안갔어요 아마 쿠션 몇개 가지고 계신데다가 스킨케어 방법하고 안맞으시면 굳이 손이 가진 않으실 수도 있을 것 같아요 하지만 제품 자체는 밀착력 좋고 어느정도 수분감도 있으면서 매우 보송하게 올라옵니다 평소 매트한 쿠션 쓰시는 분들은 만족하실 것 같아요 킬커버 같은 커버력은 아니지만 커버력도 좀 있어서 피부 좋으신 분들은 조금 두꺼우실 수도 있지만 이런 기능에 비해 매우 얇게 발린다고 느꼈습니다
285,285,5,21.04.29.,세상에 웬일이에요 받자마자 놀랐어요타 헤라도 구매해 봤지만 현대킨텍스점이 단연 최고에요 구성품도 사진과 다를때가 많은데사진과 동일하게 보내주셨구요선물포장이 하나하나 정성스럽게 움직,세상에 웬일이에요 받자마자 놀랐어요타 헤라도 구매해 봤지만 현대킨텍스점이 단연 최고에요 구성품도 사진과 다를때가 많은데사진과 동일하게 보내주셨구요선물포장이 하나하나 정성스럽게 움직이지않게 고정하여 박스에 넣어주셔서 열자마자 감동받았어요전국 헤라에서 현대킨텍스점 상주셔야 해요앞으로 꼭 여기서 사려구요 구성품도 전국등입니다 어찌 쓸까요 감사합니다 또 올게용
286,286,5,21.03.30.,백화점 및 로드샵 브랜드 좋다는거 다 써봐도 헤라쿠션만한 커버력을 본적이 없어서 늘 써왔는데 이번에 리뉴얼 됐다는 소식 듣고 부리나케 구매했어요 리뉴얼된 케이스가 아주 약간 더,백화점 및 로드샵 브랜드 좋다는거 다 써봐도 헤라쿠션만한 커버력을 본적이 없어서 늘 써왔는데 이번에 리뉴얼 됐다는 소식 듣고 부리나케 구매했어요 리뉴얼된 케이스가 아주 약간 더 큰데 자석형으로 바뀌어서 저 편하구 로고도 심플하니 좋아요기존에는 호 썼었는데 약간 노란빛도는게 아쉬워서 리뉴얼된 로 구매했는데 딱 원하던 색이에요 노란끼가 빠진 호 색 커버는 말할것도 없구 밀착도 너무좋네요이번에 네이버포인트도 받고 쿠션도 개나 더 받구 네이버쇼핑 혜택 넘 좋은거같아요 ㅎㅎ 행사 많이많이해쥬세요 
287,287,5,21.04.12.,블랙쿠션 안맞아서 서랍에 넣어뒀다가 어쩌다 꺼냐 썼는데 너무 찰떡인거예요 리필을 살까하다가 뉴블랙 쿠션이라길래 사봤는데 이전 블랙쿠션보다 찝찝한 느낌이나 무거운느낌도 없고 퍼프,블랙쿠션 안맞아서 서랍에 넣어뒀다가 어쩌다 꺼냐 썼는데 너무 찰떡인거예요 리필을 살까하다가 뉴블랙 쿠션이라길래 사봤는데 이전 블랙쿠션보다 찝찝한 느낌이나 무거운느낌도 없고 퍼프도 부드럽게 두드려져요처음에 쿠션 여는 버튼이 없어서 엥했는데 자석형식이고 케이스도 올블랙으로 더 예쁘고 고급져졌어요제품도 좋고 샘플도 센스넘치시게 쿠션 호수 맞춰서 보내주셔서 이마저도 너무 감동이었어요헤라브랜드가 엄마가 애정하는 브랜드라 저는 좀 멀리했는데 지금까지 해외브랜드에 뒤쳐지지 않는 이유를 써보니까 알겠어요
288,288,5,21.04.14.,벼루다벼루다 한참 찾아보고 고민끝에 삿어요 쿨톤인데 기존 블랙쿠션쓰고 잇다가 쿨톤로바꾸니까 완전 딱마음에들어요 색깔 사은품도 여기가 제일 마음에들어요 향수냄세 저격 스킨로,벼루다벼루다 한참 찾아보고 고민끝에 삿어요 쿨톤인데 기존 블랙쿠션쓰고 잇다가 쿨톤로바꾸니까 완전 딱마음에들어요 색깔 사은품도 여기가 제일 마음에들어요 향수냄세 저격 스킨로션 샘플대신 파운데이션 샘플로 받고싶다고 요청 한번 조심스레말해봣는데 재고가 있어 봐꿔주셧어용 친절하셔요 이왕이래 타임타임받아서 비교샷가용 손은 매우타서 누래보이는데 얼굴은겨쿨입니당
289,289,5,21.04.17.,기존 헤라블랙호 사용했었기에 이번에 리뉴얼된 제품이 엄청 궁금했고 기대가 컸었어요아침에 화장하구 점심시간쯤만 되면 티존 위주로 기름이 엄청 올라오는 수부지 피부라 오후,기존 헤라블랙호 사용했었기에 이번에 리뉴얼된 제품이 엄청 궁금했고 기대가 컸었어요아침에 화장하구 점심시간쯤만 되면 티존 위주로 기름이 엄청 올라오는 수부지 피부라 오후 시쯤만 되면 화장이 다 무너지고 뽕뽕뽕 떴었는데이번 리뉴얼된 제품으로 화장하니 무너짐과 피부와 화장의 분리ㅋㅋ가 너무나도 확연히 덜한거에요기적 정말 거짓말안하고 기적 저는 유분기가 많은 피부라 마스크에 화장이 안묻진 않지만 이런 어마어마한 개선점으로 점 만점에 점을 드립니다ㅎㅎ예전 블랙쿠션 리필 아직 개 남았는데어떻게 처리해야할지 난감하네요ㅋㅋ
290,290,3,21.03.31.,우선 배송은 잘 받았구요 그런데 상품포장시 뭔일이 있었나 지저분한 먼지가루 같은것이 많이 묻어있네요ㅠㅠ 물티슈로 닦긴했지만 첨에 받았을땐 기분이 좋진않네요ㅠ 미니백은 정말,우선 배송은 잘 받았구요 그런데 상품포장시 뭔일이 있었나 지저분한 먼지가루 같은것이 많이 묻어있네요ㅠㅠ 물티슈로 닦긴했지만 첨에 받았을땐 기분이 좋진않네요ㅠ 미니백은 정말 미니백이고 기대에 미치지 못합니다 어느 정도 사이즈는 될꺼라고 생각했는데 정말 팩트 하나 들어가면 끝일듯 그리고 정말 허접하게 붙인 자국도 다 나네요ㅠ미니백은 영 아닌듯합니다 커버력은 아직 사용전이라 어떤지 모르겠지만 좋다고 하니 기대합니다 많이 판매하고 급하다고 해서 포장이 이렇게 먼지 가득 엉망인건 좀 아닌듯 싶습니다
291,291,5,21.04.05.,와우 일단 빠른 배송에 깜짝 놀랐습니다 주말 주문이라 당연히 아무리 빨리 와도 화요일 도착 예상 했는데 사실 저는 해외에서 거주중이고 주문 해서 부모님댁으로 보내드리면 부모님,와우 일단 빠른 배송에 깜짝 놀랐습니다 주말 주문이라 당연히 아무리 빨리 와도 화요일 도착 예상 했는데사실 저는 해외에서 거주중이고 주문 해서 부모님댁으로 보내드리면 부모님이 다시 저에게 보내 주실 예정이라 빨리 도착 해야 제가 좀 더 빨리 받을 수 있는 상황이라매장에서 빨리 준비해 주신 덕분에 정말 빠르게 받았네요 블랙쿠션의 좋은 점이야 블랙 쿠션 구매 하시려는 분들은 다 아실거고 ㅎㅎ 해외에 있다보니 저에게 맞는 화장품 찾기가 쉽지 않아요 일부 유명 메이커 제품들은 다 있지만 가격이나 제품 만족도에 있어서 저랑 잘 맞지 않아서 결국 한국에 있을 때 쓰던 헤라 생각이 나서 이리저리 검색을 했었고 그중에서도 이곳이 선택 했어요 사진은 부모님이 보내 주신 사진 올렸는데 ㅎㅎ 제가 빨리 받으면 월 중순에항공료가 느므 올라 선편으로  ㅠㅠ ㅋ 받을 수 있을 듯 한데 그때 한달 후기 제대로 올려 볼께요 ㅎㅎ 
292,292,5,21.04.02.,평소 호를 쓰는데 이랑 랑 고민하다가 구입했어요 얼굴에 비해 목이 노란편이라 걱정했는데 둥둥 뜨지않고 화사합니다 제일 걱정했던 부분이 주름끼임이였는데 주름끼,평소 호를 쓰는데 이랑 랑 고민하다가 구입했어요 얼굴에 비해 목이 노란편이라 걱정했는데 둥둥 뜨지않고 화사합니다 제일 걱정했던 부분이 주름끼임이였는데 주름끼임 전혀 없어서 대만족입니다 매트하고 커버력있는 제품 사용안한지 꽤 됐었는데 바르는 순간 피부결이 보송하고 너무 예뻐보여요 볼부분은 건조한 편인데 스킨으로만 닦아내고 발라보았는데 살짝 건조한 느낌이 있긴하나 기초 제대로 하고 바르면 건조할거 같진 않네요
293,293,4,21.04.15.,우선 기존의 블랙쿠션에 비해 밀착력이 정말 좋아졌어요 가벼워졌다고 할까요 저는 커버가 안되더라도 가벼운게 순위여서인지 만족했습니다 다만 기존 블랙쿠션 쓸때 향이 별로여서 리,우선 기존의 블랙쿠션에 비해 밀착력이 정말 좋아졌어요 가벼워졌다고 할까요 저는 커버가 안되더라도 가벼운게 순위여서인지 만족했습니다 다만 기존 블랙쿠션 쓸때 향이 별로여서 리뉴얼 된건 향을 좀 잡아줬을까 하는 기대는 있었는데 기존엔 엄마화장품 같은 냄새라면 지금은 화장품 냄새보다는 무슨 화학고무냄새 같은 느낌이랄까요 냄새는 전에꺼는 바르고 마스크 쓰면 냄새가 마스크 안에서 났는데 이번꺼는 바를땐 냄새가 나지만 마스크 쓰면 냄새가 신경쓰일정도로 많이 나지는 않아요 빨리 날라가서 괜찮아요 다만 코 밑에 바를때 냄새가 너무 역해요 세대 블쿠 향 리뉴얼 기대해봅니다
294,294,5,21.04.22.,제가건성이라 기초안하고 쓰면 뜨는감은 확실이 있습니다 그런데 시간이 지나면 더 뜨는게아니라 착붙 되는 느낌이 되고 색이 아주 잘나와서 마음에 드네용근데 사은품 미니가방은 진짜,제가건성이라 기초안하고 쓰면 뜨는감은 확실이 있습니다 그런데 시간이 지나면 더 뜨는게아니라 착붙 되는 느낌이 되고 색이 아주 잘나와서 마음에 드네용근데 사은품 미니가방은 진짜 아니에요 정말 안주는것만 못해요 이걸 어디다가 쓰라고 주신거죠ㅜㅜ사진은 그나마 잘나온거에요
