,Unnamed: 0,평점,날짜,제목,내용
1176,1176,4,21.03.30.,호 인데  사기 잘 했네요손등에 펴 바르자마자 가장자리부터 다크닝이 생기는 걸 보니 호로 샀음 더 어두웠을 뻔했어요 호인데 왜 핑크색으로 다크닝이 오는,호 인데  사기 잘 했네요손등에 펴 바르자마자 가장자리부터 다크닝이 생기는 걸 보니 호로 샀음 더 어두웠을 뻔했어요 호인데 왜 핑크색으로 다크닝이 오는 건지 모르겠는데 호로 사길 잘했고블랙파데 호보다는 살짝 어둡네요
1177,1177,4,21.04.03.,리뉴얼 전보다 얇고 밀착력은 좋은데 커버력은 조금 떨어지는 것 같은 느낌이엇어요더 자연스럽달까 그래서 같은 호수인데도 더 어두운 것 같은 느낌이 들엇어요 피부 좋으신분들,리뉴얼 전보다 얇고 밀착력은 좋은데 커버력은 조금 떨어지는 것 같은 느낌이엇어요더 자연스럽달까 그래서 같은 호수인데도 더 어두운 것 같은 느낌이 들엇어요 피부 좋으신분들은 더 자연스럽게 화장할수잇을것같아용 ㅎㅎ
1178,1178,5,21.04.19.,쿠션 유목민이에요 한달동안 샤넬디올입생로랑맥에스티로더지방시사서 써보고 헤라쿠션도 좋다길래 망설이다 샀어요 아주예전에 한번써봤는데 좋다는 느낌없었거든요ㅠ근데 도착하자마자 써,쿠션 유목민이에요 한달동안 샤넬디올입생로랑맥에스티로더지방시사서 써보고 헤라쿠션도 좋다길래 망설이다 샀어요 아주예전에 한번써봤는데 좋다는 느낌없었거든요ㅠ근데 도착하자마자 써봤는데 한달간 산 쿠션중에 젤 만족중 일정도 더 써보고 좋으면 헤라로 갈아타야겠어용
1179,1179,5,21.04.23.,리뉴얼전 블랙쿠션이 엄청 잘 맞아서 몇년째 쓰고 있었는데 리뉴얼되고나서 더 좋아졌다고 해서 믿고 구입했습니다 일단 먼저 열어보니 색감이 너무 예뻐졌네요 ㅠㅠ 직접 사용ㅎㅐ본 후,리뉴얼전 블랙쿠션이 엄청 잘 맞아서 몇년째 쓰고 있었는데 리뉴얼되고나서 더 좋아졌다고 해서 믿고 구입했습니다 일단 먼저 열어보니 색감이 너무 예뻐졌네요 ㅠㅠ 직접 사용ㅎㅐ본 후기는 한달 다시 쓸게요 ㅎㅎ 샘플도 많이 챙겨주시고 공식 스토어인데도 불구하고 가장 저렴하게 산듯합니다
1180,1180,5,21.04.19.,기존에 쓰고 있던 헤라 제품이 너무 좋아서 리뉴얼 쿠션도 구매했어요 상담해주셨던 분도 정말 친절해서 기분이 너무 좋았어요 ㅎㅎ 샘플이랑 파우치도 잘 받았습니다 엄마랑 같,기존에 쓰고 있던 헤라 제품이 너무 좋아서 리뉴얼 쿠션도 구매했어요 상담해주셨던 분도 정말 친절해서 기분이 너무 좋았어요 ㅎㅎ 샘플이랑 파우치도 잘 받았습니다 엄마랑 같이 쓰려고 구매했는데 여기서 사길 잘한거 같아용 
1181,1181,5,21.04.08.,마스크쓰고 안묻어나는 쿠션찾다가첨 써보는데 요즘 낮에 걸으면 살짝 더울때콧등에 약간 묻는거 빼고는 안묻어나서 좋아요피부에도 완전 착붙이고 얇게 발리면서도 커버력이 좀 있어요세미,마스크쓰고 안묻어나는 쿠션찾다가첨 써보는데 요즘 낮에 걸으면 살짝 더울때콧등에 약간 묻는거 빼고는 안묻어나서 좋아요피부에도 완전 착붙이고 얇게 발리면서도 커버력이 좀 있어요세미매트라 너무 건조하지도 않고 아주 적당합니다
1182,1182,5,21.04.04.,일단 진짜 얇게 발리고 안무겁고 지속력 대단합니다 아침 시에 바르고 마스크 쓰고 활동했는데 밤 시 까지 말쩡 했어요다만 건성분들은 좀 건조할 수 있을거 같구요 커버력이 미,일단 진짜 얇게 발리고 안무겁고 지속력 대단합니다 아침 시에 바르고 마스크 쓰고 활동했는데 밤 시 까지 말쩡 했어요다만 건성분들은 좀 건조할 수 있을거 같구요 커버력이 미친듯이 좋은건 아니라 컨실러 써야 할듯요 홍조는 다 가려집니다 암튼 조아요 ㅠㅠ역시 리뉴얼은 닥사 ㅜㅜ 구냥사세요
1183,1183,5,21.04.21.,배송도 빠르고 진짜 적은양으로 잘발려요 촉촉하게 발리는데 마무리감은 보송합니다라네즈 네오쿠션 색상이랑 거의 똑같을만큼 비슷한데 양쪽으로 발라봐도 큰차이없음 미세한 차이라면,배송도 빠르고 진짜 적은양으로 잘발려요 촉촉하게 발리는데 마무리감은 보송합니다라네즈 네오쿠션 색상이랑 거의 똑같을만큼 비슷한데 양쪽으로 발라봐도 큰차이없음미세한 차이라면 라네즈는 화사한느낌 헤라는 차분한느낌 정도 테스트를 못해보고 사서 걱정했는데 잘맞아용 
1184,1184,5,21.04.09.,제가 써본 쿠션 중 최고인거같아요 ㅎㅎ 시간 지나도 기름지는것도 덜하고 굉장히 자연스럽게 커버되네요 화떡되는거 딱 싫은데 그런 느낌이 없어요그리고 톡톡 문의 드렸는데 상담도 빠,제가 써본 쿠션 중 최고인거같아요 ㅎㅎ 시간 지나도 기름지는것도 덜하고 굉장히 자연스럽게 커버되네요 화떡되는거 딱 싫은데 그런 느낌이 없어요그리고 톡톡 문의 드렸는데 상담도 빠르구 친절하세요 중간에 사은품 받기로 한게 잘못왔었는데 그 부분도 빠르게 해결해주셨어요 감사합니다 재구매해도 여기서 재구매 할게요
1185,1185,5,21.04.07.,이번에 처음으로 해라 쿠션 도전했는데 하루만에 배송오고 사은품을 이렇게 꼼꼼하게 챙겨주는 건 처음이에요 너무 좋고 상품도 유통기한이 많이 남은 제품이라 넉넉해서 잘 사용할 것,이번에 처음으로 해라 쿠션 도전했는데 하루만에 배송오고 사은품을 이렇게 꼼꼼하게 챙겨주는 건 처음이에요 너무 좋고 상품도 유통기한이 많이 남은 제품이라 넉넉해서 잘 사용할 것 같아요색상도 고민 많이 했는데 잘 맞아서 다음에도 또 시킬 것 같아요
1186,1186,5,21.04.11.,일단 구성 너무 만족하고 가격도 이정도면 괜찮은 것 같아요ㅎㅎ 좀 더 써봐야 알겠지만 건성인데 너무 건조하지 않고 마스크 묻어남도 딱히 없네요 밀착도 쫀쫀하게 잘되는 것 같아요,일단 구성 너무 만족하고 가격도 이정도면 괜찮은 것 같아요ㅎㅎ 좀 더 써봐야 알겠지만 건성인데 너무 건조하지 않고 마스크 묻어남도 딱히 없네요 밀착도 쫀쫀하게 잘되는 것 같아요 무엇보다 자석이라 여닫기 너무 편해요ㅠㅠ 외관도 깔끔한게 맘에 들어서 들고다니기 좋아요ㅎㅎ
1187,1187,5,21.04.02.,블랙쿠션 말만 들었었지 처음 써봤는데 정말 너무 좋네요 전 트러블 피부가 아니라서 초밀착으로 선택했고 마스크에 덜묻어나길 간절히 바랐는데 원래쓰던 쿠션에 반의반밖에 안묻어나요ㅎㅎ,블랙쿠션 말만 들었었지 처음 써봤는데 정말 너무 좋네요 전 트러블 피부가 아니라서 초밀착으로 선택했고 마스크에 덜묻어나길 간절히 바랐는데 원래쓰던 쿠션에 반의반밖에 안묻어나요ㅎㅎ 지속력도 이만하면 합격 계속 블랙쿠션 쓸게요
1188,1188,4,21.05.06.,바닐라색상이 품절이 많아서 배송 걱정했는데 다행이 배송도 빠르고 사은품도 주셔서 감사해요 다른제품은 번들거리는데 헤라블랙은 덜한거 같아서 리뉴얼된 블랙으로 주문,바닐라색상이 품절이 많아서 배송 걱정했는데 다행이 배송도 빠르고 사은품도 주셔서 감사해요 다른제품은 번들거리는데 헤라블랙은 덜한거 같아서 리뉴얼된 블랙으로 주문했어요 케이스도 전에꺼보다 고급져보이네요 
1189,1189,5,21.04.12.,예전 리뉴얼되기전 블랙쿠션을 만족스럽게 써서 이번에 리뉴얼된 제품으로 구매해봤는데 만족스럽네요ㅎㅎ 피부가 지성이라 쿠션바르고 나면 얼마 안있어서 다 무너졌는데 지속력도 좋고 커버도,예전 리뉴얼되기전 블랙쿠션을 만족스럽게 써서 이번에 리뉴얼된 제품으로 구매해봤는데 만족스럽네요ㅎㅎ 피부가 지성이라 쿠션바르고 나면 얼마 안있어서 다 무너졌는데 지속력도 좋고 커버도 잘돼요 이 쿠션으로 정착할거같네요ㅎㅎ 근데 한가지 단점을 화장품 냄새가 좀 진하게 나요ㅠㅠ그거 빼고선 다 좋습니당
1190,1190,5,21.04.15.,사용하던 타사 제품을 거의 썼을때 때마침 블랙쿠션 할인해서 구입해봤어요 평소에 호쓰면 밝고 호쓰면 너무 어두웠는데 호 썼는데도 어둡지 않고 잘 맞아요헤라 쿠션은,사용하던 타사 제품을 거의 썼을때 때마침 블랙쿠션 할인해서 구입해봤어요 평소에 호쓰면 밝고 호쓰면 너무 어두웠는데 호 썼는데도 어둡지 않고 잘 맞아요헤라 쿠션은 예전에도 사용했었는데 블랙쿠션 너무 잘 먹고 지속력도 좋아요
1191,1191,4,21.05.01.,커버력은 정말 좋아요 그런데 마스크 쓴 코 입 부분이 지저분하게 무너져내리는건 타사 다른 쿠션이나 파데랑 비슷한 것 같아요 초밀착이라고 광고하시던데 잘 모르겠어요ㅠㅠ 근데,커버력은 정말 좋아요 그런데 마스크 쓴 코 입 부분이 지저분하게 무너져내리는건 타사 다른 쿠션이나 파데랑 비슷한 것 같아요 초밀착이라고 광고하시던데 잘 모르겠어요ㅠㅠ 근데 내장된 퍼프가 너무너무 좋아서 점 줍니다
1192,1192,2,21.05.28.,민감성 피부인데 하 이거 쓰고 피부 뒤집어져서 급하게 다른 쿠션 사서 바꿨습니다 성분 검색해보니 안 좋은 성분들이 다른 쿠션들보다 많고 두껍게 발려지더라구요 제 친구도 이거 쓰다가,민감성 피부인데 하 이거 쓰고 피부 뒤집어져서 급하게 다른 쿠션 사서 바꿨습니다 성분 검색해보니 안 좋은 성분들이 다른 쿠션들보다 많고 두껍게 발려지더라구요 제 친구도 이거 쓰다가 뭐가 나서 바꿧는데 그 친구도 두껍게 발려진다 하네요 두꺼워서 그런지 커버력은 좋아요
1193,1193,5,21.04.06.,마스크에 덜 묻어나는 제품이라고 해서 구매해봤는데 확실히 다른 쿠션하고 비교해서 거의 안묻어나요 밥 먹는다고 마스크 벗을 때 덜 민망함ㅋㅋ커버력도 좋아서 한번 살짝 찍고 덜어내서,마스크에 덜 묻어나는 제품이라고 해서 구매해봤는데 확실히 다른 쿠션하고 비교해서 거의 안묻어나요 밥 먹는다고 마스크 벗을 때덜 민망함ㅋㅋ커버력도 좋아서 한번 살짝 찍고 덜어내서 발랐는데도 커버가 잘돼요대신에 매트하게 마무리되서 기초를 촉촉하게 하거나 선크림을 촉촉한걸로 써야할듯
1194,1194,5,21.04.09.,배송엄청빨라요 목욜새벽에 결제했는데 금욜오후에받았어요쿠션하나샀는데 샘플을 왕창보내주셨어요블랙파데본품의 용량을 주시다니파데샘플에 파우치땜에 혹해서샀어요,배송엄청빨라요목욜새벽에 결제했는데 금욜오후에받았어요쿠션하나샀는데 샘플을 왕창보내주셨어요블랙파데본품의 용량을 주시다니파데샘플에 파우치땜에 혹해서샀어요블쿠너무좋아서 파데도 써보고싶었는데
1195,1195,5,21.03.29.,유튜브 보고 우연히 블랙쿠션이 새로 나왔다는걸 알았는데 이벤트할때 살 수 있어서 다행이네요 ㅎㅎ 기존 블랙쿠션을 안 써봤는데 워낙 평이 좋아서 사봤습니다 사은품도 빵빵해서 좋고 배,유튜브 보고 우연히 블랙쿠션이 새로 나왔다는걸 알았는데 이벤트할때 살 수 있어서 다행이네요 ㅎㅎ 기존 블랙쿠션을 안 써봤는데 워낙 평이 좋아서 사봤습니다 사은품도 빵빵해서 좋고 배송도 빠르고 무엇보다 박스가 테이프 없이 와서 너무 좋아요 케이스도 고급지고 앞으로 잘 사용할 것 같습니다
1196,1196,5,21.04.07.,헤라블쿠는 여기가 짱이네요 제가 쓰고 너무좋아서 바로 선물용으로 하나 더 샀어요 ㅎㅎ사실 첨에 저는 다른데서 사서 퍼프랑 픽서만 받았는데 증정은 여기가 짱이네요 제꺼도 하나,헤라블쿠는 여기가 짱이네요제가 쓰고 너무좋아서 바로 선물용으로 하나 더 샀어요 ㅎㅎ사실 첨에 저는 다른데서 사서 퍼프랑 픽서만 받았는데 증정은 여기가 짱이네요제꺼도 하나 더 쟁여야겠어요정성스럽게 보내주셔서 감사합니다  더 기분좋게사용할수있겠어요 돈주고산건데 마치 선물받은그런기분
1197,1197,5,21.04.04.,기존 블랙파운데이션 을 사용하는데 시간이 지나면 노란끼가 도는 것 같아서 고민하다가 블랙쿠션 로 구매하였습니다 사진은 왼쪽이  오른쪽이 파운데이션 입니,기존 블랙파운데이션 을 사용하는데 시간이 지나면 노란끼가 도는 것 같아서 고민하다가 블랙쿠션 로 구매하였습니다 사진은 왼쪽이  오른쪽이 파운데이션 입니당 결과적으로는 만족하구요 생각보다 밝기 차이가 많이 나는 것 같습니당
1198,1198,2,21.03.31.,팩트를 찾다가 헤라 블랙쿠션이 리뉴얼되어서 출시 되었다고 보고 결정했는데 저는 후기랑 이런거 다 찾아 보고 결정한거였는데ㅜㅜ요즘 시국에 마스크가 필수인 시점에서 마스크에 찰떡이니,팩트를 찾다가 헤라 블랙쿠션이 리뉴얼되어서 출시 되었다고 보고 결정했는데 저는 후기랑 이런거 다 찾아 보고 결정한거였는데ㅜㅜ요즘 시국에 마스크가 필수인 시점에서 마스크에 찰떡이니 묻어나지 않니 이런글 보고 의아 해서 믿는셈치고 결정했는데ㅠㅠ묻어남이 없을수는 없지만 이건 그냥 커버조차ㅜㅜ저는 묻어남이 거의이고 화장이 다 뜨고 다 묻어나서 너무 별루네요 라이브 방송도 보고 결정한거라서ㅜ믿고 구매 했는데 그리고 이제 날씨가 따뜻해지니 좀 무거운감이 있어서 여름에는 사용 못할듯 싶네요
1199,1199,5,21.05.07.,유트루 파리녀 리뷰보고 구매합니다 늘 고민하다가 팩트 교체시기가 와서 오늘 처음 써보고 출근했는데 아직까진 대만족 중입니다 ㅎㅎ날은 더워지고 마스크때문에 유분기가 금방 올라,유트루 파리녀 리뷰보고 구매합니다 늘 고민하다가 팩트 교체시기가 와서 오늘 처음 써보고 출근했는데 아직까진 대만족 중입니다 ㅎㅎ날은 더워지고 마스크때문에 유분기가 금방 올라오는데 잘 잡아주길 기대해봅니다 ㅎㅎㅎ
1200,1200,5,21.03.31.,와 새로 바꼈대서 주문했는데 진짜 맘에들어요톤도 화사하고 커버도 잘되고 매트한 걸 좋아하는데 세미매트여서 진짜 너무 건조하지도 않고 좋네요 와 대박ㅋㅋ 쿠션,와 새로 바꼈대서 주문했는데 진짜 맘에들어요톤도 화사하고 커버도 잘되고 매트한 걸 좋아하는데 세미매트여서 진짜 너무 건조하지도 않고 좋네요 와 대박ㅋㅋ 쿠션 정착합니다ㅎㅎ 사은품으로 넣어주신 것들도 잘 쓸게요
1201,1201,5,21.04.15.,평소 블파랑 블쿠 모두 잘 사용하고 있었는데 이번 라이브때 좋은 혜택 및 구성으로 준비해주셔서 바로 구매했어욤 역시 헤라 블랙 라인 최고 배송도 빠르고 컨실러 선물까지 진짜,평소 블파랑 블쿠 모두 잘 사용하고 있었는데 이번 라이브때 좋은 혜택 및 구성으로 준비해주셔서 바로 구매했어욤 역시 헤라 블랙 라인 최고 배송도 빠르고 컨실러 선물까지 진짜 구성 대박입니다ㅠㅠㅠ 앞으로도 라이브 자주 보고 구매도 자주 할게요
1202,1202,4,21.04.23.,호왐호 중간정도의 피부톤이라 호수찾는게 항상어려워요 호 선택했는데 노란피부인 저에게는 쬐금 밝게 느껴지네요 소량만해도 얼굴전체 커버 되구요 전 잡티 어느정도 보이는,호왐호 중간정도의 피부톤이라 호수찾는게 항상어려워요 호 선택했는데 노란피부인 저에게는 쬐금 밝게 느껴지네요 소량만해도 얼굴전체 커버 되구요 전 잡티 어느정도 보이는걸 좋아해요 그래서 더 소량만 써요 약간의 광택이 느껴지는 보송함이 표현됩니다
1203,1203,5,21.04.03.,기존 블랙쿠션 계속 쓰던 사람인데 이번에 한번 새로 나온걸로 써볼까 싶어서 쟁여둔것 두고 써봤어요 쓰던것보다 조금 촉촉해지고 뭔가 좀 가볍게 발리는 느낌이에요 커버력도 괜찮고,기존 블랙쿠션 계속 쓰던 사람인데 이번에 한번 새로 나온걸로 써볼까 싶어서 쟁여둔것 두고 써봤어요 쓰던것보다 조금 촉촉해지고 뭔가 좀 가볍게 발리는 느낌이에요 커버력도 괜찮고 지속력도 괜찮고 좋네요 특히 개인적으론 향기가 기존꺼보다 훨씬 좋아져서 너무 좋아요
1204,1204,5,21.04.16.,드디어 저도 겟했어요ㅎㅎ 처음 라방때 애들땜에 정신없어서 못 사고ㅠ 드디어 샀네요 평소 헤라 쿠션 썼었지에 고민도 안하고 바로 구매 좋은 조건에 사은품도 많고 최고에요ㅎㅎ,드디어 저도 겟했어요ㅎㅎ처음 라방때 애들땜에 정신없어서 못 사고ㅠ 드디어 샀네요평소 헤라 쿠션 썼었지에 고민도 안하고 바로 구매좋은 조건에 사은품도 많고 최고에요ㅎㅎ마스크 쓸때 필요한 헤라쿠션ㅎ미니가방은 딸한테 뺏길거 같네요 그리고 역시 자연을 생각하는 종이상자 종이테잎 종이충전제 최고최고
1205,1205,5,21.04.16.,컨실러때문에 주문했던거 취소하고 알람까지 맞춰 놓고 기다렸는데 라이브방송 주문을 처음 해보는 나ㅠㅜ 같은 시간에 오픈한 다른 라이브에서 주문해놓고 구성이 내가 본거랑 다르다며,컨실러때문에 주문했던거 취소하고 알람까지 맞춰 놓고 기다렸는데 라이브방송 주문을 처음 해보는 나ㅠㅜ 같은 시간에 오픈한 다른 라이브에서 주문해놓고 구성이 내가 본거랑 다르다며 ㅡㅡ 결국 여기저기 찾다 발견이미 컨실러는 끝 하지만 미니쿠션이라도 받고싶어 다른방송 주문 취소하고 여기서 다시주문하고 슬퍼하고 있었는데 오늘 택배를 여는순간 컨실러가 왜거기에 있는거죠ㅎ 나의 간절했던 마음이 통한걸까요 넘 행복합니다
1206,1206,5,21.04.17.,지난번 방송때 퍼프 미니백 놓치고 구매 했는데 이번에 또 방송하길래 또 구매 해버렸네요 ㅎㅎ 가방이 기대 만큼은 아니지만 가격대비 좋은 구성이라만족합니다 세 세트 언제 다 쓰,지난번 방송때 퍼프 미니백 놓치고 구매 했는데이번에 또 방송하길래 또 구매 해버렸네요 ㅎㅎ가방이 기대 만큼은 아니지만 가격대비 좋은 구성이라만족합니다 세 세트 언제 다 쓰지 ㅋㅋ 일반 파운데이션도 궁금해요 혜택 많이 넣어서방송해주세요 ㅎㅎ 
1207,1207,5,21.04.26.,블랙쿠션 계속 쓰다가 이번에 새로 나온 제품이 좋다고들 그래서 구매하게되었습니다 다른곳 모두 품절로만 나오고 따로 입고 날짜는 없어서 출고 날짜 적혀있던 이곳에서 구매하게 되었고,블랙쿠션 계속 쓰다가 이번에 새로 나온 제품이 좋다고들 그래서 구매하게되었습니다 다른곳 모두 품절로만 나오고 따로 입고 날짜는 없어서 출고 날짜 적혀있던 이곳에서 구매하게 되었고 딱맞게 보내주셨네요 기존 제품도 좋았지만 확실히 리뉴얼 제품이 더 밀착도 잘되고 화사하니 좋습니다
1208,1208,5,21.04.10.,기초를 탄탄히 하지 않던 피부라 세미매트한 블랙쿠션을 바르면 건조해보이지만 이건 기초를 꾸준히 신경쓰면 전혀 문제없을거같아요 ㅎㅎ사은품도 좋은걸 보내주셔서 받자마자 기분이 좋더라구,기초를 탄탄히 하지 않던 피부라 세미매트한 블랙쿠션을 바르면 건조해보이지만 이건 기초를 꾸준히 신경쓰면 전혀 문제없을거같아요 ㅎㅎ사은품도 좋은걸 보내주셔서 받자마자 기분이 좋더라구요 ㅎㅎ앞으로 구매는 여기서만 할게요
1209,1209,5,21.04.14.,라이브방송 구성진짜 대박이에요ㅠㅠ 사은품 사이즈 궁금해 하실것같아서 전체 사진으로 남깁니다 아직 사용전이지만 여러 유트브 후기보니깐 세미메트 제형이라고 해서 저랑 잘맞을것같아요,라이브방송 구성진짜 대박이에요ㅠㅠ 사은품 사이즈 궁금해 하실것같아서 전체 사진으로 남깁니다 아직 사용전이지만 여러 유트브 후기보니깐 세미메트 제형이라고 해서 저랑 잘맞을것같아요 쿠션 실제로 보니깐 너무너무 예쁘고 고급져요ㅠㅠ 러이브방송 또 해주세요 말해모해 진짜 짱입니당
1210,1210,5,21.04.20.,몇 일 사용해보고 쓰는 글입니다 이전에 리뉴얼 되기 전부터 해라 블랙쿠션 쓰고 있었는데 이번에 호수가 늘어나면서 선택 폭이 더 넓어져서 좋았어요 물론 리뉴얼된 상품도 정말 좋습,몇 일 사용해보고 쓰는 글입니다 이전에 리뉴얼 되기 전부터 해라 블랙쿠션 쓰고 있었는데 이번에 호수가 늘어나면서 선택 폭이 더 넓어져서 좋았어요 물론 리뉴얼된 상품도 정말 좋습니다 ㅎㅎㅎ질문도 많이했는데 하나하나 답변 친절히 해주셔서 너무 감사했구요 사은품도 정말 많이챙겨주셔서 직접 매장에서 산 기분이 들었어요 다쓰면 또 여기서 살거에요 감사합니다
1211,1211,4,21.04.05.,저는 헤라 글로우 파데를 너무 만족하면서 써서 여름용으로 구매해봤습니다 확실히 기존에 블랙보다 얇아졌습니다 근데 건성분들이 쓰시기에는 부적합한거같아여 저도 볼은 건성 티존은 복합,저는 헤라 글로우 파데를 너무 만족하면서 써서 여름용으로 구매해봤습니다 확실히 기존에 블랙보다 얇아졌습니다 근데 건성분들이 쓰시기에는 부적합한거같아여 저도 볼은 건성 티존은 복합성인데 볼분은 발랏을때 건조한 느낌이 확드네여
1212,1212,4,21.04.13.,음이 품절이라 어쩔수없이  주문 해 보았습니다 제가 아이 쿠션 호 둘 다 사용하는 사람인데 속건성이 심해서ㅜㅜ 지금은 글래딩 사용중이고 블랙은 좀 더,음이 품절이라 어쩔수없이  주문 해 보았습니다 제가 아이 쿠션 호 둘 다 사용하는 사람인데 속건성이 심해서ㅜㅜ 지금은 글래딩 사용중이고 블랙은 좀 더 더워지면 사용하려구 미리 구매했어요 가 붕뜰거라 생각하시는 분들걱정 안하셔도 됩니다 붕뜨지도 화사하지도 않아요ㅋ
1213,1213,5,21.04.07.,주문할때 구성과 다르게 동그란미니백도 없이 전혀 다른,주문할때 구성과 다르게 동그란미니백도 없이 전혀 다른 구성으로 왔지만 퍼프개는 와서 괜찮아요그런데 구성이 전혀 다르게 와서 뭐가 안온건지 모르겠네요ㅋㅋㅋ리뉴얼전에 사용할땐 건조했는데 리뉴얼되고 보습은 좀 더 되는거 같지만 건성피부는 기초를 빵빵하게 하고 사용하는게 좋을꺼 같아요
1214,1214,5,21.04.19.,항상 헤라 블랙쿠션만 쓰다가 같은 아모레 라인으로 아이오페가 새로 리뉴얼 되었다고 해서 구매했던 인입니다 하지만 역시 베스트셀러는 이유가 있듯이 다시 블랙쿠션으로 돌아왔습니다,항상 헤라 블랙쿠션만 쓰다가 같은 아모레 라인으로 아이오페가 새로 리뉴얼 되었다고 해서 구매했던 인입니다 하지만 역시 베스트셀러는 이유가 있듯이 다시 블랙쿠션으로 돌아왔습니다 가벼우면서도 커버까지 완벽한 팩트는 블랙쿠션이에요ㅎㅎ 다른곳 찾아갈 필요 없습니다ㅋㅋ 저는 이제 다신 다른곳으로 눈 안돌려요ㅋㅋ
1215,1215,3,21.04.14.,우선 지속력이 오래 유지되어 좋아요커버력을 우선시하다보면 몇시간후 화장이 금세 번들거리고 칙칙해지는데 헤라는 그런게 없어 좋습니다 하지만 세미매트타입이라 건성피부에게는 너무,우선 지속력이 오래 유지되어 좋아요커버력을 우선시하다보면 몇시간후 화장이 금세 번들거리고 칙칙해지는데 헤라는 그런게 없어 좋습니다 하지만 세미매트타입이라 건성피부에게는 너무 매트해서 잔주름이 너무 잘 보이네요
